{
  "schemaVersion": 1,
  "resultVersion": "0.1.0",
  "status": "pass",
  "ownerIssue": 119,
  "planVersion": "0.1.0-local.1",
  "scenarioId": "local-single-equivocation",
  "testId": "chaos.consensus.local.single-validator-equivocation",
  "executed": true,
  "provenance": {
    "gitCommit": "c81cb1ca4f0f17fe461b03a2c2f1fd07288e1693",
    "dirtyWorktree": false,
    "patchSha256": null,
    "toolchainSha256": "7429c9d76ac7ea3a9ebec540a53690872e929e8fdd9359631b8b37c2f6879cc8",
    "binaryIdentity": "toriumd (toriumd:local)",
    "binarySha256": "cf3a0da5f899ac5dbf819252d8b8c87758d94ce040f2182701bc1207c7636343",
    "genesisSha256": "86d77e6e1907e10e92217e1484cbf89e224b03bacdbf67f441b3307502a96808",
    "effectiveConfigSha256": "ea5dbd49d14ac134f4405f57d4a071f4740948c158ef26830856dcb632b1bb17",
    "hostIdentity": "Darwin 25.3.0 arm64 (15 cores)",
    "runnerIdentity": "chain/resilience/run-scenario-v0.mjs@0.1.0",
    "seed": 20260729
  },
  "run": {
    "startedAt": "2026-07-29T20:25:01.454Z",
    "endedAt": "2026-07-29T20:25:20.045Z",
    "cosmosChainId": "torium-localnet-1",
    "evmChainId": 1414484556,
    "startHeight": 3,
    "endHeight": 11,
    "baselineBlockHash": "BCCD11A95BACF9107F4553D9F70240FD49A425A29AC38D55550500D3EC1E1162",
    "baselineAppHash": "7DBDD9E449D3D514AEA77A17A970A2B1B6296442ECE010269CC4FCDD0A34C86F"
  },
  "timeline": [
    {
      "at": "2026-07-29T20:25:01.460Z",
      "kind": "baseline",
      "height": 3,
      "note": "all four validators reachable at the baseline committed height"
    },
    {
      "at": "2026-07-29T20:25:04.262Z",
      "kind": "change-applied",
      "height": 3,
      "note": "fault injected per the scenario module"
    },
    {
      "at": "2026-07-29T20:25:14.309Z",
      "kind": "expected-behavior-observed",
      "height": 8,
      "note": "expected liveness/finality behavior observed under the fault"
    },
    {
      "at": "2026-07-29T20:25:14.309Z",
      "kind": "recovery-started",
      "height": 8,
      "note": "operator recovery action started"
    },
    {
      "at": "2026-07-29T20:25:20.012Z",
      "kind": "recovery-complete",
      "height": 11,
      "note": "every validator reached the canonical recovery height"
    }
  ],
  "observations": {
    "nodes": [
      {
        "nodeId": "validator-0",
        "reachable": true,
        "height": 11,
        "blockHash": "4219FB583A0D81B5E14B93AE9D98E6F16E807157A4BD83DACF99D969F71D4A1A",
        "appHash": "29900435351CDB2D27E8E45339799C9EF7D71A7A4F1BF6256C5BFFB3AE01AA5E",
        "validatorsHash": "5304B3E13BE3E6E007E5D11A2C95E2D47BDC59202FCF6E648C9268814D753ECB"
      },
      {
        "nodeId": "validator-1",
        "reachable": true,
        "height": 11,
        "blockHash": "4219FB583A0D81B5E14B93AE9D98E6F16E807157A4BD83DACF99D969F71D4A1A",
        "appHash": "29900435351CDB2D27E8E45339799C9EF7D71A7A4F1BF6256C5BFFB3AE01AA5E",
        "validatorsHash": "5304B3E13BE3E6E007E5D11A2C95E2D47BDC59202FCF6E648C9268814D753ECB"
      },
      {
        "nodeId": "validator-2",
        "reachable": true,
        "height": 11,
        "blockHash": "4219FB583A0D81B5E14B93AE9D98E6F16E807157A4BD83DACF99D969F71D4A1A",
        "appHash": "29900435351CDB2D27E8E45339799C9EF7D71A7A4F1BF6256C5BFFB3AE01AA5E",
        "validatorsHash": "5304B3E13BE3E6E007E5D11A2C95E2D47BDC59202FCF6E648C9268814D753ECB"
      },
      {
        "nodeId": "validator-3",
        "reachable": true,
        "height": 11,
        "blockHash": "4219FB583A0D81B5E14B93AE9D98E6F16E807157A4BD83DACF99D969F71D4A1A",
        "appHash": "29900435351CDB2D27E8E45339799C9EF7D71A7A4F1BF6256C5BFFB3AE01AA5E",
        "validatorsHash": "5304B3E13BE3E6E007E5D11A2C95E2D47BDC59202FCF6E648C9268814D753ECB"
      }
    ],
    "committedStates": [
      {
        "nodeId": "validator-0",
        "height": 3,
        "blockHash": "BCCD11A95BACF9107F4553D9F70240FD49A425A29AC38D55550500D3EC1E1162",
        "appHash": "7DBDD9E449D3D514AEA77A17A970A2B1B6296442ECE010269CC4FCDD0A34C86F",
        "commitVotingPower": 100
      },
      {
        "nodeId": "validator-1",
        "height": 3,
        "blockHash": "BCCD11A95BACF9107F4553D9F70240FD49A425A29AC38D55550500D3EC1E1162",
        "appHash": "7DBDD9E449D3D514AEA77A17A970A2B1B6296442ECE010269CC4FCDD0A34C86F",
        "commitVotingPower": 100
      },
      {
        "nodeId": "validator-2",
        "height": 3,
        "blockHash": "BCCD11A95BACF9107F4553D9F70240FD49A425A29AC38D55550500D3EC1E1162",
        "appHash": "7DBDD9E449D3D514AEA77A17A970A2B1B6296442ECE010269CC4FCDD0A34C86F",
        "commitVotingPower": 100
      },
      {
        "nodeId": "validator-3",
        "height": 3,
        "blockHash": "BCCD11A95BACF9107F4553D9F70240FD49A425A29AC38D55550500D3EC1E1162",
        "appHash": "7DBDD9E449D3D514AEA77A17A970A2B1B6296442ECE010269CC4FCDD0A34C86F",
        "commitVotingPower": 100
      },
      {
        "nodeId": "validator-0",
        "height": 4,
        "blockHash": "802A8FF4121CB317CDE259D5E4966930F3044A282EF1B4C6F6964ECBF7CFE3A8",
        "appHash": "70E5296410E5F035CEF80994A96D0576E0475E1CDC7586ABD1ABDE842AE24A3E",
        "commitVotingPower": 100
      },
      {
        "nodeId": "validator-1",
        "height": 4,
        "blockHash": "802A8FF4121CB317CDE259D5E4966930F3044A282EF1B4C6F6964ECBF7CFE3A8",
        "appHash": "70E5296410E5F035CEF80994A96D0576E0475E1CDC7586ABD1ABDE842AE24A3E",
        "commitVotingPower": 100
      },
      {
        "nodeId": "validator-2",
        "height": 4,
        "blockHash": "802A8FF4121CB317CDE259D5E4966930F3044A282EF1B4C6F6964ECBF7CFE3A8",
        "appHash": "70E5296410E5F035CEF80994A96D0576E0475E1CDC7586ABD1ABDE842AE24A3E",
        "commitVotingPower": 100
      },
      {
        "nodeId": "validator-3",
        "height": 4,
        "blockHash": "802A8FF4121CB317CDE259D5E4966930F3044A282EF1B4C6F6964ECBF7CFE3A8",
        "appHash": "70E5296410E5F035CEF80994A96D0576E0475E1CDC7586ABD1ABDE842AE24A3E",
        "commitVotingPower": 100
      },
      {
        "nodeId": "validator-0",
        "height": 5,
        "blockHash": "7A7FA46A754E6629D01284AAA0699D0B354E1751FF0E7EDD178EA9DA5A0D4834",
        "appHash": "BF950E0FFDE61C84B3D8DED68879E6268A64248634EE01837586972BEF360678",
        "commitVotingPower": 75
      },
      {
        "nodeId": "validator-1",
        "height": 5,
        "blockHash": "7A7FA46A754E6629D01284AAA0699D0B354E1751FF0E7EDD178EA9DA5A0D4834",
        "appHash": "BF950E0FFDE61C84B3D8DED68879E6268A64248634EE01837586972BEF360678",
        "commitVotingPower": 75
      },
      {
        "nodeId": "validator-2",
        "height": 5,
        "blockHash": "7A7FA46A754E6629D01284AAA0699D0B354E1751FF0E7EDD178EA9DA5A0D4834",
        "appHash": "BF950E0FFDE61C84B3D8DED68879E6268A64248634EE01837586972BEF360678",
        "commitVotingPower": 75
      },
      {
        "nodeId": "validator-3",
        "height": 5,
        "blockHash": "7A7FA46A754E6629D01284AAA0699D0B354E1751FF0E7EDD178EA9DA5A0D4834",
        "appHash": "BF950E0FFDE61C84B3D8DED68879E6268A64248634EE01837586972BEF360678",
        "commitVotingPower": 75
      },
      {
        "nodeId": "validator-0",
        "height": 6,
        "blockHash": "BCE43EE357B1830198F94D880E50ABA0669A644F61666393942CEDF2116DD476",
        "appHash": "D09DA62C96FF1C23E341299E29C3F955A0CD829DC58FCCD76062F9E546DD2735",
        "commitVotingPower": 100
      },
      {
        "nodeId": "validator-1",
        "height": 6,
        "blockHash": "BCE43EE357B1830198F94D880E50ABA0669A644F61666393942CEDF2116DD476",
        "appHash": "D09DA62C96FF1C23E341299E29C3F955A0CD829DC58FCCD76062F9E546DD2735",
        "commitVotingPower": 100
      },
      {
        "nodeId": "validator-2",
        "height": 6,
        "blockHash": "BCE43EE357B1830198F94D880E50ABA0669A644F61666393942CEDF2116DD476",
        "appHash": "D09DA62C96FF1C23E341299E29C3F955A0CD829DC58FCCD76062F9E546DD2735",
        "commitVotingPower": 100
      },
      {
        "nodeId": "validator-3",
        "height": 6,
        "blockHash": "BCE43EE357B1830198F94D880E50ABA0669A644F61666393942CEDF2116DD476",
        "appHash": "D09DA62C96FF1C23E341299E29C3F955A0CD829DC58FCCD76062F9E546DD2735",
        "commitVotingPower": 100
      },
      {
        "nodeId": "validator-0",
        "height": 7,
        "blockHash": "DEED1C300D127B95F022C92B76D73EFD20F5AC83BA19F3DCAAB467E058CA7581",
        "appHash": "71D4C5B19C51570B0B96EA8C7EFE9A8790162C74D40E57A394A2AA629461700F",
        "commitVotingPower": 100
      },
      {
        "nodeId": "validator-1",
        "height": 7,
        "blockHash": "DEED1C300D127B95F022C92B76D73EFD20F5AC83BA19F3DCAAB467E058CA7581",
        "appHash": "71D4C5B19C51570B0B96EA8C7EFE9A8790162C74D40E57A394A2AA629461700F",
        "commitVotingPower": 100
      },
      {
        "nodeId": "validator-2",
        "height": 7,
        "blockHash": "DEED1C300D127B95F022C92B76D73EFD20F5AC83BA19F3DCAAB467E058CA7581",
        "appHash": "71D4C5B19C51570B0B96EA8C7EFE9A8790162C74D40E57A394A2AA629461700F",
        "commitVotingPower": 100
      },
      {
        "nodeId": "validator-3",
        "height": 7,
        "blockHash": "DEED1C300D127B95F022C92B76D73EFD20F5AC83BA19F3DCAAB467E058CA7581",
        "appHash": "71D4C5B19C51570B0B96EA8C7EFE9A8790162C74D40E57A394A2AA629461700F",
        "commitVotingPower": 100
      },
      {
        "nodeId": "validator-0",
        "height": 8,
        "blockHash": "31C774A003A8FD7E28F4F96B4F803BBEFFBEAB5B9BC28959C5ADE2A1C84961D1",
        "appHash": "CBCA72896F413CCECAD9E95394C7C580C17BA510D1F142595DA332B499ACBCA6",
        "commitVotingPower": 100
      },
      {
        "nodeId": "validator-1",
        "height": 8,
        "blockHash": "31C774A003A8FD7E28F4F96B4F803BBEFFBEAB5B9BC28959C5ADE2A1C84961D1",
        "appHash": "CBCA72896F413CCECAD9E95394C7C580C17BA510D1F142595DA332B499ACBCA6",
        "commitVotingPower": 100
      },
      {
        "nodeId": "validator-2",
        "height": 8,